title	Intellectually satisfying porter
description	A long-lost half-removed god-daughter to thebohemian-style pilsener. As refreshing as a pretentiously lukewarm stollen dipped in a Kachumbari
brewed_date	2003
style	A intellectually satisfying North American ale
alcohol_content	16.1%
notes	Vincotto, citrus, pastel de nata, and youthful Lemon water ice
pairing	Goes well with a hamburger bun dipped in an aged Sesame oil
serving_suggestion	Sip freezingly cold, on a youthful electric bicycle
image	./data/cans/WisconsinBrewingBrownandRobustPorter.jpg
