title	Soft south german-style weizenbock
description	An estranged half-removed god-daughter to theaustralasian-style light lager. As refreshing as a freezingly cold gulab jamun dipped in an Ajvar
brewed_date	2009
style	A soft German ale
alcohol_content	5.9%
notes	Dijon ketchup, citrus, croissant, and aged Fried Oysters
pairing	Goes well with a pain au levain dipped in a worn Salmoriglio
serving_suggestion	Indulge freezingly cold, on a fresh solar powered segway
image	./data/cans/bentpaddle14.jpg
