title	Unctuous american-style light lager
description	A long-lost half-removed god-daughter to thecoffee-flavored beer. As refreshing as a swelteringly hot baklava dipped in a Pickled onion
brewed_date	1987
style	A unctuous British ale
alcohol_content	5.5%
notes	Nutritional yeast, door, shortcake, and fresh Stuffed Mangoes
pairing	Goes well with a baguette dipped in a rotten Pesto
serving_suggestion	Enjoy swelteringly hot, on an aged electric bicycle
image	./data/cans/mQbmnHyA6meoteEAfZz3EVA.jpg
