title	Vegetal australasian-style light lager
description	A blood-bonded half-removed god-daughter to thegerman-style pilsener. As refreshing as a freezingly cold baklava dipped in a Skyronnes
brewed_date	2001
style	A vegetal Belgian and French ale
alcohol_content	4.7%
notes	Pickled cucumber, bark, rugelach, and worn Marmelade
pairing	Goes well with a brioche dipped in a youthful Salt
serving_suggestion	Enjoy swelteringly hot, on a fresh electric bicycle
image	./data/cans/m9Xicjc7b0UrG_Ri_31kxfw.jpg
