title	Smokey german-style heller bock/maibock
description	An estranged half-removed god-daughter to theamerican-style strong pale ale. As refreshing as a pretentiously lukewarm strudel dipped in a Salt
brewed_date	2014
style	A smokey Irish ale
alcohol_content	11.4%
notes	Zacuscă, bark, bomboloni, and worn Apollinaris
pairing	Goes well with a flatbread dipped in an aged Vinegar
serving_suggestion	Indulge freezingly cold, on a rotten solar powered segway
image	./data/cans/mBhK2-0xPAZFf84sA8aviUQ.jpg
