title	Alcoholic latin american-style light lager
description	A long-lost half-removed god-daughter to thescottish-style heavy ale. As refreshing as a swelteringly hot rugelach dipped in a Kachumbari
brewed_date	2005
style	A alcoholic Belgian and French ale
alcohol_content	9.3%
notes	Teriyaki sauce, door, pastel de nata, and worn Canape of Anchovies
pairing	Goes well with a naan dipped in an aged Fish paste
serving_suggestion	Indulge freezingly cold, on a fresh solar powered segway
image	./data/cans/m9Xicjc7b0UrG_Ri_31kxfw.jpg
