title	Full tropical-style light lager
description	A long-lost half-removed god-daughter to thegerman-style doppelbock. As refreshing as a pretentiously lukewarm profiterole dipped in a Kachumbari
brewed_date	2000
style	A full German ale
alcohol_content	5.5%
notes	Fish sauce, citrus, pastel de nata, and rotten Hominy
pairing	Goes well with a roti dipped in a youthful Milkette
serving_suggestion	Indulge swelteringly hot, on a fresh solar powered segway
image	./data/cans/m1Tz1Onze7HlCUNGqWFrD-w.jpg
